CODE	Label - English	Label - French	Label - German	Standard code	Note (EN only)	EC_corporate_code	EC_corporate_uri
PC_UNE	Percentage of unemployment	Pourcentage du chômage	Anteil der Arbeitslosen	M			
PC_ACT	Percentage of population in the labour force	Pourcentage de la population active	Anteil der Erwerbspersonen	M			
PC_ACT_HC	Percentage of population in the labour force - numerator in head count (HC)	Pourcentage de la population active - numérateur exprimé en nombre de personnes physiques (PP)	Prozent der Erwerbsbevölkerung - im Zähler: Kopfzahl	M			
PC_ACT_FTE	Percentage of population in the labour force - numerator in full-time equivalent (FTE)	Pourcentage de la population active - numérateur exprimé en équivalents temps plein (ETP)	Prozent der Erwerbsbevölkerung - im Zähler: Vollzeitäquivalent (VZÄ)	M			
PC_INAC	Percentage of population outside the labour force	Pourcentage de la population inactive	Anteil der Nichterwerbspersonen	M			
PC_INAC_WWRK	Percentage of population outside the labour force and wanting to work	Pourcentage de la population inactive qui veut travaillée	Anteil an den Nichterwerbspersonen, die arbeiten möchten	M			
PC_SAL	Percentage of employees	Pourcentage des salariés	Prozent der Arbeitnehmer	M			
PC_SAL_TEMP	Percentage of employees with a temporary job	Pourcentage des salariés avec un emploi temporaire	Prozent der Arbeitnehmer mit einer befristeten Arbeitsstelle	M			
PC_EMP_HC	Percentage of total employment - numerator in head count (HC)	Pourcentage de l'emploi total - numérateur exprimé en nombre de personnes physiques (PP)	Prozent der Gesamtbeschäftigung - im Zähler: Kopfzahl	M			
PC_EMP_FTE	Percentage of total employment - numerator in full-time equivalent (FTE)	Pourcentage de l'emploi total - numérateur exprimé en équivalents temps plein (ETP)	Prozent der Gesamtbeschäftigung - im Zähler: Vollzeitäquivalent (VZÄ)	M			
PC_ELF	Percentage of extended labour force	Pourcentage de la population active étendue	Prozent der erweiterten Erwerbsbevölkerung	M			
PC_TSCO	Percentage of total revenues from taxes and social contributions (including imputed social contributions)	Pourcentage du produit total des impôts et des cotisations sociales (y compris cotisations sociales imputées)	Prozentualer Anteil an den Gesamteinnahmen aus Steuern und Sozialabgaben (einschließlich unterstellter Sozialabgaben)	M			
PC_TSCO_X_ISCO	Percentage of total revenues from taxes and social contributions (excluding imputed social contributions)	Pourcentage du produit total des impôts et des cotisations sociales (hors cotisations sociales imputées)	Prozentualer Anteil an den Gesamteinnahmen aus Steuern und Sozialabgaben (ausschließlich unterstellter Sozialabgaben)	M			
PC_GDP	Percentage of gross domestic product (GDP)	Pourcentage du produit intérieur brut (PIB)	Prozent des Bruttoinlandsprodukts (BIP)	M			
PC_GVA	Percentage of gross value added (GVA)	Pourcentage de la valeur ajoutée brute (VAB)	Prozent der Bruttowertschöpfung (BWS)	M			
PC_GNI	Percentage of gross national income (GNI)	Pourcentage du revenu national brut (RNB)	Prozentualer Anteil am Bruttonationaleinkommen (BNE)	M			
PC_DI	Percentage of disposable income	Pourcentage du revenu disponible	Prozent des verfügbaren Einkommens	M			
PC_GADI	Percentage of gross adjusted disposable income	Pourcentage du revenu disponible brut ajusté	Prozentsatz verfügbares Einkommen, brutto	M			
PC_LE	Percentage of stocks (closing balance sheet)	Pourcentage des stocks (bilan de clôture)	Prozentsatz Aktien (Bilanz am Jahresende)	M			
PC_GEXP	Percentage of government expenditure	Pourcentage des dépenses des administrations publiques	Prozentualer Anteil von den Ausgaben des Staates	M			
PC_BEN	Percentage of total benefits	Pourcentage du total des prestations	Prozentualer Anteil von den Leistungen insgesamt	M			
PC_FUNC	Percentage of total function	Percentage of total function	Prozentualer Anteil an der Funktionen insgesamt	M			
PC_EXP	Percentage of total expenditure	Pourcentage du total des dépenses	Prozentualer Anteil von den Ausgaben insgesamt	M			
PC_PEXP	Percentage of total public expenditure	Pourcentage du total des dépenses publiques	Prozentualer Anteil an den öffentlichen Ausgaben insgesamt	M			
PC_REC	Percentage of total receipts	Pourcentage du total des recettes	Prozentualer Anteil von den Einnahmen insgesamt	M			
PC_CHE	Percentual share of total current health expenditure (CHE)	Pourcentage de la dépense de santé courante	Prozent der Laufende Gesundheitsausgaben	M			
PC_WRL	Percentage of world total	Pourcentage du total mondial	Prozent von Welt insgesamt	M			
PC_HH	Percentage of households	Pourcentage des ménages	Prozent der Haushalte	M			
PC_IND	Percentage of individuals	Pourcentage des particuliers	Prozent der Personen	M			
PC_HC	Percentage based on head count (HC)	Pourcentage basé sur le nombre de personnes physiques (PP)	Prozent basierend auf Kopfzahlen	M			
PC_FTE	Percentage based on full-time equivalents (FTE)	Pourcentage basé sur les équivalents temps plein (ETP)	Prozent auf Basis von Vollzeitäquivalent (VZÄ)	M			
PC_GBA	Percentage of total GBARD	Pourcentage du total CBPRD	Prozent des GBARD insgesamt	M			
PC_GERD	Percentage of gross domestic expenditure on R&D (GERD)	Pourcentage des dépenses intérieures brutes de R&D (GERD)	Prozent der Bruttoinlandsausgaben für F&E (GERD)	M			
PC_DT	Distance to target in percentage	Écart par rapport aux objectifs en pourcentage	Abstand vom Ziel in Prozent	M			
PC_FAT	Fat content (% of product weight)	Teneur en matières grasses (% du poids du produit)	Fettgehalt (% des Produktgewichtes)	M			
PC_PRO	Protein content (% of product weight)	Teneur en protéines (% du poids du produit)	Eiweißgehalt (% des Produktgewichtes)	M			
PC_TOT	Percentage of total	Pourcentage du total	Prozent vom Gesamtwert	M			
PC_TOT_PER	Percentage of total (based on persons)	Pourcentage du total (basé sur les personnes)	Prozent des Gesamtwerts (auf Basis von Personen)	M			
PC_TOT_HW	Percentage of total (based on hours worked)	Pourcentage du total (basé sur les heures travaillées)	Prozent des Gesamtwerts (auf Basis von geleisteten Arbeitsstunden)	M			
PC_TOT_HAB	Percentage of total (based on inhabitants)	Pourcentage du total (basé sur les habitants)	Prozent der Gesamtzahl (auf Basis von Einwohnern)	M			
PC_TOT_FTE	Percentage of total (based on full-time equivalents)	Pourcentage du total (basé sur les équivalents temps plein)	Prozent der Gesamtzahl (auf Basis von Vollzeiteinheiten)	M			
PC_TOT_JOB	Percentage of total (based on jobs)	Pourcentage du total (basé sur les emplois)	Prozent des Gesamtwerts (auf Basis von Arbeitsplätzen)	M			
PC_EXT_EU	Percentage of Extra EU	Pourcentage d'Extra UE	Prozentsatz der Extra-EU	M			
PC_EU27_2020	Percentage of EU27 (from 2020) total	Pourcentage du total de l'UE27 (à partir de 2020)	Prozent von EU27 (ab 2020) insgesamt	M			
PC_EU28	Percentage of EU28 (2013-2020) total	Pourcentage du total de l'UE28 (2013-2020)	Prozent von EU28 (2013-2020) insgesamt	M			
PC_EU27_2007	Percentage of EU27 (2007-2013) total	Pourcentage du total de l'UE27 (2007-2013)	Prozent von EU27 (2007-2013) insgesamt	M			
PC_EU27_2020_EUR_HAB	Percentage of EU27 (from 2020) total (based on euro per inhabitant)	Pourcentage du total de l'UE27 (à partir de 2020, basé sur les euros par habitant)	Prozent von EU27 (ab 2020) insgesamt (auf Basis von Euro pro Einwohner)	M			
PC_EU27_2020_PPS_HAB	Percentage of EU27 (from 2020) total (based on purchasing power standards per inhabitant)	Pourcentage du total de l'UE27 (à partir de 2020, basé sur le standard de pouvoir d'achat par habitant)	Prozent von EU27 (ab 2020) insgesamt (auf Basis von Kaufkraftstandards pro Einwohner)	M			
PC_EU27_2020_PPS_EMP	Percentage of EU27 (from 2020) total (based on purchasing power standards per employed person)	Pourcentage du total de l'UE27 (à partir de 2020, basé sur le standard de pouvoir d'achat par salarié)	Prozent von EU27 (ab 2020) insgesamt (auf Basis von Kaufkraftstandards pro Arbeitnehmer)	M			
PC_EU27_2020_MEUR	Percentage of EU27 (from 2020) total (based on million euro)	Pourcentage du total de l'UE27 (à partir de 2020, basé sur des millions d'euros	Prozent von EU27 (ab 2020) insgesamt (auf Basis von Millionen Euro)	M			
PC_EU27_2020_MPPS	Percentage of EU27 (from 2020) total (based on million purchasing power standards)	Pourcentage du total de l'UE27 (à partir de 2020, basé sur des millions de standards de pouvoir d'achat)	Prozent von EU27 (ab 2020) insgesamt (auf Basis von Millionen Kaufkraftstandards)	M			
PC_EU27_2020_MEUR_CP	Percentage of EU27 (from 2020) total (based on million euro), current prices	Pourcentage du total de l'UE27 (à partir de 2020, basé sur des millions d'euros), prix courants	Anteil am Gesamtwert für die EU27 (ab 2020) in Prozent (auf Basis von Millionen Euro), jeweilige Preise	M			
PC_EU27_2020_MPPS_CP	Percentage of EU27 (from 2020) total (based on million purchasing power standards), current prices	Pourcentage du total de l'UE27 (à partir de 2020, basé sur des millions de standards de pouvoir d'achat), prix courants	Anteil am Gesamtwert für die EU27 (ab 2020) in Prozent (auf Basis von Kaufkraftstandards), jeweilige Preise	M			
PC_EU27_2020_HAB_MEUR_CP	Percentage of EU27 (from 2020) total per capita (based on million euro, EU27 from 2020), current prices	Pourcentage du total de l'UE27 (à partir de 2020) par personne (basé sur des millions d'euros, UE27 à partir de 2020), prix courants	Anteil am Gesamtwert für die EU27 (ab 2020) in Prozent (auf Basis von Millionen Euro, EU27 ab 2020), pro Kopf, jeweilige Preise	M			
PC_EU27_2020_HAB_MPPS_CP	Percentage of EU27 (from 2020) total per capita (based on million purchasing power standards, EU27 from 2020), current prices	Pourcentage du total de l'UE27 (à partir de 2020) par personne (basé sur des millions de standards de pouvoir d'achat, UE27 à partir de 2020), prix courants	Anteil am Gesamtwert für die EU27 (ab 2020) in Prozent (auf Basis von Millionen Kaufkraftstandards, EU27 ab 2020), pro Kopf, jeweilige Preise	M			
PC_EA_MEUR	Percentage of euro area total (based on million euro)	Pourcentage du total de la zone euro (basé sur des millions d'euros)	Prozent vom Euroraum insgesamt (auf Basis von Millionen Euro)	M			
PC_GDP_3Y	Percentage of GDP - three-year average	Pourcentage du PIB - moyenne sur 3 ans	Anteil des BIP - Dreijahresdurchschnitt	M			
PC_GDP_NSA	Percentage of gross domestic product (GDP), (NSA)	Pourcentage du produit intérieur brut (PIB), (NSA)	Prozent des Bruttoinlandsprodukts (BIP), (NSA)	M			
PC_GDP_SCA	Percentage of gross domestic product (GDP), (SCA)	Pourcentage du produit intérieur brut (PIB), (SCA)	Prozent des Bruttoinlandsprodukts (BIP), (SCA)	M			
PC_ENT	Percentage of enterprises	Pourcentage des entreprises	Prozent der Unternehmen	M			
PC_ENT_CC	Percentage of enterprises buying CC services	Pourcentage d'entreprises achetant des services CC	Prozent der Unternehmen, die kostenpflichtige CC-Dienste beziehen	M			
PC_ENT_BDA	Percentage of enterprises analysing big data internally or externally	Pourcentage des entreprises analysant des données massives en interne ou en externe	Prozent der Unternehmen, die Big Data analysieren, intern oder extern	M			
PC_ENT_BD	Percentage of enterprises analysing big data	Pourcentage des entreprises analysant des données massives	Prozent der Unternehmen, die Big Data analysieren	M			
PC_ENT_IOT1	Percentage of enterprises using Internet of Things (as of 2021)	Pourcentage des entreprises utilisant IOT (à partir de 2021)	Prozent der Unternehmen, die IOT verwenden (ab 2021)	M			
PC_ENT_IOT	Percentage of enterprises using Internet of Things	Pourcentage des entreprises utilisant IOT	Prozent der Unternehmen, die IOT verwenden	M			
PC_ENT_RFID1	Percentage of enterprises using RFID (as of 2014)	Pourcentage d'entreprises utilisant RFID (à partir de 2014)	Prozent der Unternehmen, die RFID einsetzen (ab 2014)	M			
PC_ENT_RFID	Percentage of the enterprises using RFID	Pourcentage d'entreprises utilisant RFID	Prozent der Unternehmen die RFID einsetzen	M			
PC_ENT_ADS	Percentage of enterprises using internet ads	Pourcentage des entreprises avec de la publicité sur l'internet	Prozent der Unternehmen mit Werbung im Internet	M			
PC_ENT_SM	Percentage of enterprises using social media	Pourcentage des entreprises utilisant des médias sociaux	Prozent der Unternehmen, die soziale Medien nutzen	M			
PC_ENT_WEB	Percentage of the enterprises having a website	Pourcentage d'entreprises disposant d'un site web	Prozent der Unternehmen die eine Website haben	M			
PC_ENT_FIXBB	Percentage of enterprises using a fixed broadband connection	Pourcentrage d'entreprises utilisant une connexion fixe à large bande	Prozent der Unternehmen, die einen festen Breitbandzugang verwenden	M			
PC_ENT_ITSPRCR2	Percentage of enterprises which recruited / tried to recruit personnel for jobs requiring ICT specialist skills (reduced comparability with 2007)	Pourcentage d'entreprises ayant essayé de recruter/ayant recruté du personnel pour des emplois nécessitant des compétences de spécialistes en TIC (comparabilité réduite avec 2007)	Prozent der Unternehmen, die versuchten/tatsächlich Mitarbeiter für Stellen eingestellt haben, die IKT-Fachkenntnisse erfordern (eingeschränkt vergleichbar mit 2007)	M			
PC_ENT_SECPOL1	Percentage of enterprises with an ICT security policy (as of 2015)	Pourcentage des entreprises ayant une politique de sécurité TIC (à partir de 2015)	Prozent der Unternehmen mit IKT Sicherheitspolitik (ab 2015)	M			
PC_ENT_SECPOL2	Percentage of enterprises with  document(s) on measures, practices or procedures on ICT security (as of 2019)	Pourcentage des entreprises disposant de documents sur les mesures, pratiques ou procédures en matière de sécurité des TIC (à partir de 2019)	Prozent der Unternehmen mit Dokumenten zu IKT-Sicherheitsmaßnahmen, -vorgehensweisen oder -verfahren (ab 2019)	M			
PC_ENT_SECPOL	Percentage of enterprises with an ICT security policy	Pourcentage des entreprises ayant une politique de sécurité TIC	Prozent der Unternehmen mit IKT Sicherheitspolitik	M			
PC_ENT_PMD1	Percentage of enterprises providing to persons employed portable devices that allow a mobile connection to the internet (as of 2016)	Pourcentage des entreprises fournissant aux personnes occupées des appareils portables pour une connexion mobile (à partir de 2016)	Prozent der Unternehmen, die Beschäftigen tragbare Geräte mit mobiler Internetverbindung zur Verfügung stellen (ab 2016)	M			
PC_ENT_PMD	Percentage of enterprises providing to persons employed portable devices that allow a mobile connection to the internet	Pourcentage des entreprises fournissant aux personnes occupées des appareils portables pour une connexion mobile	Prozent der Unternehmen, die Beschäftigen tragbare Geräte mit mobiler Internetverbindung zur Verfügung stellen	M			
PC_ENT_AWSELL	Percentage of enterprises with web sales	Pourcentage des entreprises ayant reçu des commandes sur un site web	Prozent der Unternehmen mit Verkäufen über die Website	M			
PC_ENT_AWSELLX	Percentage of enterprises without web sales	Pourcentage des entreprises n'ayant pas reçu de commandes sur un site web	Prozent der Unternehmen ohne Verkäufe über die Website	M			
PC_ENT_AWSEU	Percentage of enterprises with web sales to other EU countries	Pourcentage des entreprises avec ventes web à d'autres pays de l'UE	Prozent der Unternehmen mit Web-Verkäufen an andere EU-Staaten	M			
PC_ENT_AEBUY	Percentage of enterprises sending e-commerce orders over the last calendar year	Pourcentage d'entreprises ayant effectué des achats par voie électronique	Prozent der Unternehmen die im letzten Kalenderjahr elektronisch eingekauft haben	M			
PC_ENT_AESELL	Percentage of enterprises receiving e-commerce orders over the last calendar year	Pourcentage des entreprises ayant reçu des commandes en ligne	Prozent der Unternehmen die im letzten Kalenderjahr elektronisch verkauft haben	M			
PC_TURN	Percentage of turnover	Pourcentage du chiffre d'affaires	Prozent des Gesamtumsatzes	M			
PC_ETURN	Percentage of turnover from e-commerce	Pourcentage du chiffre d'affaires électroniques	Prozent des elektronischen Umsatzes	M			
PC_AWSVAL	Percentage of web sales	Pourcentage du chiffre d'affaires réalisé via un site web	Prozent des Umsatzes über eine Website	M			
PC_EMP_PMD1	Percentage of persons employed working in enterprises which provide mobile devices (as of 2016)	Pourcentage des personnes occupées travaillant dans des entreprises qui fournissent des appareils portables (à partir de 2016)	Prozent der Beschäftigten in Unternehmen, die tragbare Geräte zur Verfügung stellen (ab 2016)	M			
PC_EMP_PMD	Percentage of persons employed working in enterprises which provide mobile devices	Pourcentage des personnes occupées travaillant dans des entreprises qui fournissent des appareils portables	Prozent der Beschäftigten in Unternehmen, die tragbare Geräte zur Verfügung stellen	M			
PC_ENT_CUSE	Percentage of the enterprises which use a computer	Pourcentage des entreprises utilisant l'ordinateur	Prozent der Unternehmen die Computer verwenden	M			
PC_ENT_IUSE	Percentage of enterprises where persons employed have access to the internet	Pourcentage des entreprises avec personnes occupées ayant accès à l'internet	Prozent der Unternehmen, in denen Beschäftigte Zugang zum Internet haben	M			
PC_ENT_IACC	Percentage of the enterprises with internet access	Pourcentage des entreprises ayant accès à l'internet	Prozent der Unternehmen die Zugang zum Internet haben	M			
PC_EMP_CUSE	Percentage of persons employed using a computer	Pourcentage des personnes occupées utilisant un ordinateur	Prozent der Beschäftigten, die Computer verwenden	M			
PC_EMP_CUSE2	Percentage of persons employed working in enterprises which use computers	Pourcentage des personnes occupées travaillant dans des entreprises qui utilisent des ordinateurs	Prozent der Beschäftigten in Unternehmen, die Computer verwenden	M			
PC_EMP_IACC	Percentage of persons employed working in an enterprise with internet access	Pourcentage des personnes occupées travaillant dans un entreprise avec accès à l'internet	Anteil der Beschäftigten, die in einem Unternehmen mit Internetzugang arbeiten	M			
PC_ENT_AI_EC	Percentage of the enterprises which ever considered to use any of the AI technologies	Pourcentage des entreprises qui ont déjà envisagé d'utiliser l’une des technologies d’IA	Prozent der Unternehmen die jemals erwägt haben, eine der aufgeführten KI-Technologien einzusetzen	M			
PC_ENT_AI_TANY	Percentage of the enterprises using at least one AI technologies	Pourcentage des entreprises utilisant au moins une des technologies d'IA	Prozent der Unternehmen die mindestens eine KI-System verwenden	M			
PC_ENT_AI_TX	Percentage of the enterprises using no AI technologies	Pourcentage des entreprises n'utilisant aucune technologies d'IA	Prozent der Unternehmen die keine KI-Systeme verwenden	M			
PC_ENT_CVD_IEM	Percentage of the enterprises which increased the percentage of persons employed having remote access to their e-mail system	Pourcentage des entreprises ayant augmenté le pourcentage de personnes occupées ayant un accès à distance à leur système de courrier électronique	Prozent der Unternehmen, die den Anteil der Beschäftigen mit Fernzugriff auf ihr E-Mail-System erhöht haben	M			
PC_ENT_CVD_IRA	Percentage of the enterprises which increased the percentage of persons employed having remote access their ICT systems other than e-mail	Pourcentage des entreprises ayant augmenté le pourcentage depersonnes occupées ayant un accès à distance aux systèmes informatiques de l’entreprise autres que le courrier électronique	Prozent der Unternehmen, die den Anteil der Beschäftigen mit Fernzugriff auf andere IKT-Systeme des Unternehmens (außer E-Mails) erhöht haben	M			
PC_ENT_CVD_IRM	Percentage of the enterprises which increased the number of their remote meetings	Pourcentage des entreprises ayant augmenté le nombre de leurs réunions à distance	Prozent der Unternehmen, die die Zahl vom virtuell veranstalteten Sitzungen erhöht haben	M			
PC_ENT_INV3SBG	Percentage of enterprises sending invoices B2BG	Pourcentage d'entreprises envoyant des factures B2BG	Prozent der Unternehmen, die elektronische Rechnungen B2BG senden	M			
PC_ENT_ADE	Percentage of enterprises using ADE	Pourcentage des entreprises utilisant l'échange automatique de données	Prozent der Unternehmen die automatisierten Datenaustausch verwenden	M			
PC_ENT_P3D	Percentage of enterprises with 3D printing	Pourcentage des entreprises utilisant l'impression 3D	Prozent der Unternehmen, die 3D Drucker nutzen	M			
PC_ENT_RA	Percentage of enterprises with persons employed having remote access	Pourcentage des entreprises employant des personnes avec un accès à distance	Prozent der Unternehmen mit Beschäftigen, die Fernzugriff haben	M			
PC_ENT_RM	Percentage of enterprises conducting remote meetings	Pourcentage des entreprises organisant des réunions à distance	Prozent der Unternehmen, die Videokonferenzen über das Internet durchführen	M			
PC_ENT_RBT	Percentage of enterprises using industrial or service robots	Pourcentage des entreprises utilisant des robots industriels ou de service	Prozent der Unternehmen, die Industrie- oder Serviceroboter nutzen	M			
PC_ENT_RBTS	Percentage of enterprises using service robots	Pourcentage des entreprises utilisant des robots de service	Prozent der Unternehmen, die Serviceroboter nutzen	M			
PC_ENT_DAOWN	Percentage of enterprises which performed Data Analytics by the enterprise's own employees	Pourcentage des entreprises où l'analyse des données pour l'entreprise est effectuée par leurs propres employés	Prozent der Unternehmen, in denen Datenanalysen von eigenen Beschäftigten durchgeführt werden	M			
PC_ENT_AI_PDI	Percentage of the enterprises which process data on individuals using AI technologies	Pourcentage des entreprises qui traitent des données sur les individus à l'aide de technologies d'IA	Prozent der Unternehmen, die personenbezogene Daten mithilfe von KI-Technologies verarbeiten	M			
PC_HH_IACC	Percentage of households with internet access at home	Pourcentage des ménages ayant accès à l'internet à domicile	Prozent der Haushalte mit häuslichem Internetzugang	M			
PC_IND_C3	Percentage of individuals who used a computer within the last 3 months	Pourcentage des particuliers ayant utilisé un ordinateur au cours des 3 derniers mois	Prozent der Personen, die in den letzten 3 Monaten einen Computer benutzt haben	M			
PC_IND_CEVR	Percentage of individuals who used a computer, ever	Pourcentage des particuliers ayant déjà utilisé un ordinateur	Prozent der Personen, die jemals einen Computer benutzt haben	M			
PC_IND_ILT12	Percentage of individuals who used internet within the last year	Pourcentage des particuliers ayant utilisés l'internet au cours de l'année dernière	Prozent der Personen, die im letzten Jahr das Internet genutzt haben	M			
PC_IGRTX	Percentage of individuals who have used internet but not for sending filled forms to public authorities	Pourcentage des particuliers ayant utilisé l'internet mais pas pour renvoyer des formulaires remplis aux pouvoirs publics	Prozent der Personen, die das Internet nutzten aber nicht zum Einreichen ausgefüllter Formulare	M			
PC_IGRTX_NAPX	Percentage of individuals who have used internet but not for sending filled forms to public authorities although they had to	Pourcentage des particuliers ayant utilisé l'internet mais pas pour renvoyer des formulaires remplis bien qu'ils avaient des formulaires officiels à renvoyer	Prozent der Personen, die das Internet nutzten aber nicht zum Einreichen ausgefüllter Formulare obwohl sie solche einreichen hätten müssen	M			
PC_IND_IU3	Percentage of individuals who used internet in the last 3 months	Pourcentage des particuliers ayant utilisés l'internet au cours des trois derniers mois	Prozent der Personen, die in den letzten drei Monaten das Internet genutzt haben	M			
PC_IND_CIANY	Percentage of individuals who have done at least one of the listed computer or internet activities	Pourcentage des particuliers ayant fait au moins une des activités informatiques ou l'internet	Prozent der Personen, die mindestens eine der angeführten Computer- oder Internetaktivitäten ausgeführt haben	M			
PC_IND_BLT12	Percentage of individuals who ordered goods or services, over the internet, for private use, in the last year	Pourcentage de particuliers ayant commandé des biens ou des services sur l'internet pour leur usage privé au cours de l'année précédente	Prozent der Personen, die im letzten Jahr Waren oder Dienstleistungen für den privaten Gebrauch über das Internet bestellt haben	M			
PC_IND_BMT12X	Percentage of individuals who ordered goods or services, over the internet, for private use, more than a year ago or who never did	Pourcentage de particuliers ayant commandé des biens ou des services sur l'internet pour leur usage privé il y a plus d'un an ou n'ayant jamais commandé	Prozent der Personen, die vor mehr als einem Jahr oder noch nie Waren oder Dienstleistungen für den privaten Gebrauch über das Internet bestellt haben	M			
PC_IND_CC_CCS	Percentage of individuals who used internet and cloud services for file saving or sharing	Pourcentage de particuliers ayant utilisé l'internet et des services de Cloud Computing pour sauvegarder ou partager des fichiers	Prozent der Personen, die Internet und Cloud Dienste zum Speichern oder Teilen von Dateien nutzten	M			
