CODE	Label - English	Label - French	Label - German	Standard code	Note (EN only)	EC_corporate_code	EC_corporate_uri
PC_IND_BUY3	Percentage of individuals who purchased online in the last 3 months	Pourcentage de particuliers ayant commandé en ligne au cours des 3 derniers mois	Prozent der Personen, die in den letzten 3 Monaten online Käufe getätigt haben	M			
PC_IND_BFFOR	Percentage of individuals who purchased online from sellers from other countries (EU or non-EU)	Pourcentage de particuliers ayant commandé en ligne auprès des vendeurs d'autres pays (UE ou hors l'UE)	Prozent der Personen mit Online Käufen von Anbietern aus anderen Staaten (EU- oder nicht EU-Staaten)	M			
PC_IND_IOT_BDKX	Percentage of individuals who have not used any internet-connected device or systems although they knew about them	Pourcentage de particuliers n'ayant pas utilisé de dispositifs ou systèmes connectés à l’internet bien qu'ils savent que cela existe	Prozent der Personen, die keine mit dem Internet verbundenen Geräte oder Systeme verwendet haben, obwohl sie von solchen Kenntnis haben	M			
PC_IND_IOT_DX	Percentage of individuals who have not used any internet-connected devices or systems	Pourcentage de particuliers n'ayant pas utilisé de dispositifs ou systèmes connectés à l’internet	Prozent der Personen, die keine mit dem Internet verbundenen Geräte oder Systeme verwendet haben	M			
PC_IND_HM	Percentage of individuals who encountered messages online that were considered to be hostile or degrading towards groups of people or individuals in the last 3 months	Prozent der Personen, die in den letzten drei Monaten online auf Nachrichten gestoßen sind, die als feindselig oder herabwürdigend gegenüber Personengruppen oder Einzelpersonen empfunden wurden	Prozent der Personen, die in den letzten drei Monaten online auf Nachrichten gestoßen sind, die als feindselig oder herabwürdigend gegenüber Personengruppen oder Einzelpersonen empfunden wurden	M			
PC_IND_IEID	Percentage of individuals who have used their electronic identification to access online services for private purpose in the last 12 months	Pourcentage des particuliers ayant utilisé leur identification électronique (eID) pour accéder à des services en ligne à des fins privées au cours des 12 derniers mois	Prozent der Personen, die ihre elektronische Identifikation (eID) in den letzten 12 Monaten für den Zugriff auf Online-Dienste zu privaten Zwecken genutzt haben	M			
PC_IND_IEIDX	Percentage of individuals who have not used their electronic identification to access online services for private purpose in the last 12 months	Pourcentage des particuliers n'ayant pas utilisé leur identification électronique (eID) pour accéder à des services en ligne à des fins privées au cours des 12 derniers mois	Prozent der Personen, die ihre elektronische Identifikation (eID) in den letzten 12 Monaten nicht für den Zugriff auf Online-Dienste zu privaten Zwecken genutzt haben	M			
PC_HH_IACCX	Percentage of households without internet access at home	Pourcentage des ménages qui n'ont pas d'accès à l'internet à la maison	Prozent der Haushalte ohne Internetzugang zu Hause	M			
PC_HH_BROADX	Percentage of households without broadband access	Pourcentage des ménages qui n'ont pas d'accès à large bande	Prozent der Haushalte ohne Breitbandzugang	M			
PC_IND_IUEVR	Percentage of individuals who used internet, ever	Pourcentage des particuliers ayant déjà utilisé l'internet	Prozent der Personen, die jemals Internet genutzt haben	M			
PC_IND_SECOITPP	Percentage of individuals who have experienced online identity theft, phishing or pharming	Pourcentage des particuliers ayant subi un vol d'identité en ligne, de l'hameçonnage ou du pharming	Prozent der Personen, bei denen Identitätsdiebstahl im Internet, Phishing oder Pharming aufgetreten ist	M			
PC_IND_MDW	Percentage of individuals who, at work, use any type of computers, portable devices or computerised equipment or machinery	Pourcentage des particuliers ayant au travail utilisé des ordinateurs fixes ou portables, d'autres appareils électroniques portables ou des équipements ou machines informatisés	Prozent der Personen, die beruflich jegliche Art von Computern, tragbare Geräte oder andere computergesteuerte Geräte oder Maschinen verwendeten	M			
PC_IND_IUMC	Percentage of individuals who have used a portable computer to access internet	Pourcentage des particuliers utilisant un ordinateur portable pour accéder à l'internet	Prozent der Personen, die einen tragbaren Computer zum Internetzugang verwenden	M			
PC_IND_IUHD	Percentage of individuals who used a handheld device to access internet	Pourcentage des particuliers utilisant un appareil de poche quelconque (handheld device) pour accéder à l'internet	Prozent der Personen, die irgendein Handheld-Gerät für den Internetzugang verwenden	M			
PC_IND_IUGOV12	Percentage of e-government users	Pourcentage des usagers de l'administration en ligne	Prozent der Nutzer von e-Government	M			
PC_IND_IUG_TV	Percentage of individuals who used the internet on a smart TV (directly connected to the internet)	Pourcentage des particuliers ayant utilisé l'internet sur une smart TV (directement connecté à l'internet)	Prozent der Personen mit Internet-Nutzung über ein Smart-TV (mit direkter Internetverbindung)	M			
PC_IND_MPP	Percentage of individuals who use a smartphone for private purposes	Pourcentage des particuliers ayant utilisé un smartphone pour l'usage privé	Prozent der Personen, die für private Zwecke ein Smartphone verwendet haben	M			
PC_IND_ILT12_SSF	Percentage of employees and self-employed who used internet within the last year	Pourcentage des salariés et travailleurs indépendants ayant utilisés internet au cours de l'année dernière	Prozent der Beschäftigten und Selbständigen, die im letzten Jahr das Internet genutzt haben	M			
PC_IND_WH	Percentage of individuals working from home	Pourcentage des particuliers ayant travaillé depuis leur domicile	Prozent der Personen, die von zu Hause aus gearbeitet haben	M			
PC_IND_WM	Percentage of individuals working at an external site or on the move	Pourcentage des particuliers ayant travaillé dans un lieu extérieur ou en déplacement	Prozent der Personen, die von auswärts oder unterwegs gearbeitet haben	M			
PC_IND_BGT3_IU3	Percentage of individuals who used internet and did not purchase online in the last 3 months	Pourcentage des particuliers ayant utilisé l'internet mais n'ayant pas commandé en ligne au cours des 3 derniers mois	Prozent der Personen, die in den letzten drei Monaten das Internet genutzt haben ohne online zu kaufen	M			
PC_IND_IOT_USE	Percentage of individuals who have used any of the mentioned internet-connected devices or systems in the last 3 months (until 2022)	Pourcentage de particuliers ayant utilisé l’un des dispositifs ou systèmes connectés à l’internet mentionnés au cours des 3 derniers mois (jusqu'en 2022)	Prozent der Personen, die eines der genannten internetverbundenen Geräte oder Systeme in den letzten 3 Monaten genutzt haben (bis 2022)	M			
PC_IND_IOT_USE2	Percentage of individuals who have used any of the mentioned internet-connected devices or systems in the last 3 months	Pourcentage de particuliers ayant utilisé l’un des dispositifs ou systèmes connectés à l’internet mentionnés au cours des 3 derniers mois	Prozent der Personen, die eines der genannten internetverbundenen Geräte oder Systeme in den letzten 3 Monaten genutzt haben	M			
PC_IND_IOT_DX2	Percentage of individuals who have not used any of the mentioned internet-connected devices or systems in the last 3 months	Pourcentage de personnes n'ayant pas utilisé l’un des dispositifs ou systèmes connectés à l’internet mentionnés au cours des 3 derniers mois	Prozent der Personen, die keines der genannten internetverbundenen Geräte oder Systeme in den letzten 3 Monaten genutzt haben	M			
PC_IND_IUOANY	Percentage of individuals who have used internet, in the last 3 months, for any of the online learning activities	Pourcentage de particuliers ayant utilisé l’internet, au cours des 3 derniers mois, pour l’une des activités d’apprentissage en ligne	Prozent der Personen, die das Internet in den letzten 3 Monaten für eine der Online-Lernaktivitiäten genutzt haben	M			
PC_IND_IUACRG	Percentage of individuals who have opened an account with a free app or service	Pourcentage de particuliers ayant ouvert un compte  auprès d'une application ou d’un service gratuit	Prozent der Personen, die ein Benutzerkonto bei einer kostenlosen App oder bei einem kostenlosen Dienst erstellt haben	M			
PC_IND_IUACDL	Percentage of individuals who have tried to delete their account of a free app or service in the last 3 months	Pourcentage de particuliers ayant essayé de supprimer leur compte  auprès d'une application ou d’un service gratuit au cours des 3 derniers mois	Prozent der Personen, die in den letzten 3 Monaten versucht haben, ihr Benutzerkonto bei einer kostenlosen App oder bei einem kostenlosen Dienst zu löschen	M			
PC_EMP_PREEMP_M12	Percentage of persons employed and previously employed within 12 months	Percentage de personnes en emploi et précédemment en emploi dans les 12 mois	Prozentualer Anteil der Beschäftigten und in den letzten 12 Monaten ehemals Beschäftigten	M			
PC_EMP_PREEMP	Percentage of persons employed and previously employed	Percentage de personnes en emploi et précédemment en emploi	Prozentualer Anteil der Beschäftigten und ehemals Beschäftigten	M			
PC_PER_HPB	Percentage of persons reporting a health problem	Pourcentage de personnes signalant un problème de santé	Prozentsatz der Personen, die ein Gesundheitsproblem melden	M			
PC_PER_ACC	Percentage of persons reporting an accident	Pourcentage de personnes signalant un accident	Prozentsatz der Personen, die einen Unfall melden	M			
PC_ALLOC	Percentage of allocation	Pourcentage de l'allocation	Prozentsatz der Zuteilung	M			
PC_GRSEXP	Percentage of total gross exports	Pourcentage des exportations brutes totales	Prozentsatz der gesamten Bruttoexporte	M			
PC_GRSEXP_EU	Percentage of EU gross exports	Pourcentage des exportations brutes de l'UE	Prozentsatz der EU-Bruttoexporte	M			
PC_ORG	Percentage of organic product	Pourcentage de produit biologique	Prozentsatz an Bio-Produkten	M			
PPCH_3Y	Percentage point change (t-(t-3))	Variation en points de pourcentage (t-(t-3))	Veränderung in Prozentpunkten (t-(t-3))	M			
PPCH_PRE	Percentage point change on previous period, contribution to GDP growth	Variation en points de pourcentage par rapport à la période précédente, contribution à la croissance du PIB,	Veränderung in Prozentpunkten gegenüber der Vorperiode, Beitrag zum BIP-Wachstum	M			
PPCH_SM	Percentage point change compared to same period in previous year, contribution to GDP growth	Variation en points de pourcentage par rapport à la période correspondante de l'année précédente, contribution à la croissance du PIB	Veränderung in Prozentpunkten gegenüber dem Vorjahreszeitraum, Beitrag zum BIP-Wachstum	M			
PCH_RV	Percentage change, real values	Variation en pourcentage, valeurs réelles	Veränderung in Prozent, Realwerte	M			
PCH_LV_M_16-19	Percentage change of the current month compared to the lowest value for the corresponding month in the period 2016-2019	Changement de pourcentage du mois courant comparé à la plus faible valeur du mois correspondant dans la période 2016-2019	Prozentuale Veränderung des aktuellen Monats gegenüber dem niedrigsten Wert des entsprechenden Monats im Zeitraum 2016-2019	M			
PCH_PRE	Percentage change on previous period	Variation en pourcentage par rapport à la période précédente	Veränderung in Prozent gegenüber der Vorperiode	M			
PCH_SM	Percentage change compared to same period in previous year	Variation en pourcentage par rapport à la période correspondante de l'année précédente	Veränderung in Prozent gegenüber dem Vorjahreszeitraum	M			
PCH_SM_EUR	Percentage change compared to same period in previous year, euro	Variation en pourcentage par rapport à la période correspondante de l'année précédente, euro	Veränderung in Prozent gegenüber dem Vorjahreszeitraum, Euro	M			
PCH_PRE_PER	Percentage change on previous period (based on persons)	Variation en pourcentage par rapport à la période précédente (basée sur les personnes)	Veränderung in Prozent gegenüber der Vorperiode (auf Basis von Personen)	M			
PCH_PRE_HW	Percentage change on previous period (based on hours worked)	Variation en pourcentage par rapport à la période précédente (basée sur les heures travaillées)	Veränderung in Prozent gegenüber der Vorperiode (auf Basis von geleisteten Arbeitsstunden)	M			
PCH_SM_PER	Percentage change compared to same period in previous year (based on persons)	Variation en pourcentage par rapport à la période correspondante de l'année précédente (basée sur les personnes)	Veränderung in Prozent gegenüber dem Vorjahreszeitraum (auf Basis von Personen)	M			
PCH_SM_HW	Percentage change compared to same period in previous year (based on hours worked)	Variation en pourcentage par rapport à la période correspondante de l'année précédente (basée sur les heures travaillées)	Veränderung in Prozent gegenüber dem Vorjahreszeitraum (auf Basis von geleisteten Arbeitsstunden)	M			
PCH_SM_JOB	Percentage change compared to same period in previous year (based on jobs)	Variation en pourcentage par rapport à la période correspondante de l'année précédente (basée sur les emplois)	Veränderung in Prozent gegenüber dem Vorjahreszeitraum (auf Basis von Arbeitsplätzen)	M			
PCH_SM_FTE	Percentage change compared to same period in previous year (based on full-time equivalents)	Variation en pourcentage par rapport à la période correspondante de l'année précédente (basée sur les équivalents temps plein)	Veränderung in Prozent gegenüber dem Vorjahreszeitraum (auf Basis von Vollzeitäquivalenten)	M			
PCH_SM_2Y	Percentage change compared to same period two years ago	Variation en pourcentage par rapport à la période correspondante il y a deux ans	Veränderung in Prozent gegenüber dem Zeitraum vor zwei Jahren	M			
PCH_SM_19	Percentage change compared to same month in 2019	Variation en pourcentage par rapport au même mois de 2019	Veränderung in Prozent gegenüber dem entsprechenden Monat in 2019	M			
PCH_PRE_NAC_CP	Percentage change on previous period, national currency, current prices	Variation en pourcentage par rapport à la période précédente, monnaie nationale, prix courants	Veränderung in Prozent gegenüber der Vorperiode, Landeswährung, jeweilige Preise	M			
PCH_5Y_CPI15_NAC	Price index - percentage change (t/t-5), based on 2015=100 and national currency	Indice des prix - variation en pourcentage (t/t-5), basée sur 2015=100 et la monnaie nationale	Preisindex - Veränderung in Prozent (t/t-5), auf Basis von 2015=100 und der Landeswährung	M			
PCH_PRE_EUR	Percentage change on previous period, euro	Variation en pourcentage par rapport à la période précédente, euro	Veränderung in Prozent gegenüber der Vorperiode, Euro	M			
PCH_PRE_HAB	Percentage change on previous period (based on inhabitants)	Variation en pourcentage par rapport à la période précédente (basée sur les habitants)	Veränderung in Prozent gegenüber der Vorperiode (auf Basis von Einwohnern)	M			
PCH_PRE_FTE	Percentage change on previous period (based on full-time equivalents)	Variation en pourcentage par rapport à la période précédente (basée sur les équivalents temps plein)	Veränderung in Prozent gegenüber der Vorperiode (auf Basis von Vollzeitäquivalenten)	M			
PCH_PRE_JOB	Percentage change on previous period (based on jobs)	Variation en pourcentage par rapport à la période précédente (basée sur les emplois)	Veränderung in Prozent gegenüber der Vorperiode (auf Basis von Arbeitsplätzen)	M			
PCH_PRE_PERS_SCA	Percentage change on previous period (based on persons, SCA)	Variation en pourcentage par rapport à la période précédente (basée sur les personnes, SCA)	Veränderung in Prozent gegenüber der Vorperiode (auf Basis von Personen, SCA)	M			
PCH_SAME_PERS_NSA	Percentage change compared to same period in previous year (based on persons, NSA)	Variation en pourcentage comparée à la période correspondante de l'année précédente (basée sur les personnes, NSA)	Veränderung in Prozent gegenüber dem Vorjahreszeitraum (auf Basis von Personen, NSA)	M			
PCH_SM_PER_NSA	Percentage change compared to same period in previous year (based on persons, NSA)	Variation en pourcentage comparée à la période correspondante de l'année précédente (basée sur les personnes, NSA)	Veränderung in Prozent gegenüber dem Vorjahreszeitraum (auf Basis von Personen, NSA)	M			
PCH_SM_PER_SCA	Percentage change compared to same period in previous year (based on persons, SCA)	Variation en pourcentage comparée à la période correspondante de l'année précédente (basée sur les personnes, SCA)	Veränderung in Prozent gegenüber dem Vorjahreszeitraum (auf Basis von Personen, SCA)	M			
PCH_M1	Percentage change m/m-1	Variation en pourcentage m/m-1	Veränderung in Prozent m/m-1	M			
PCH_M1_NSA	Percentage change m/m-1 (NSA)	Variation en pourcentage m/m-1 (NSA)	Veränderung in Prozent m/m-1 (NSA)	M			
PCH_M1_SA	Percentage change m/m-1 (SA)	Variation en pourcentage m/m-1 (SA)	Veränderung in Prozent m/m-1 (SA)	M			
PCH_M1_SCA	Percentage change m/m-1 (SCA)	Variation en pourcentage m/m-1 (SCA)	Veränderung in Prozent m/m-1 (SCA)	M			
PCH_Q1_NSA	Percentage change q/q-1 (NSA)	Variation en pourcentage q/q-1 (NSA)	Veränderung in Prozent q/q-1 (NSA)	M			
PCH_Q1_SCA	Percentage change q/q-1 (SCA)	Variation en pourcentage q/q-1 (SCA)	Veränderung in Prozent q/q-1 (SCA)	M			
PCH_Q4_NSA	Percentage change q/q-4 (NSA)	Variation en pourcentage q/q-4 (NSA)	Veränderung in Prozent q/q-4 (NSA)	M			
PCH_Q4_SCA	Percentage change q/q-4 (SCA)	Variation en pourcentage q/q-4 (SCA)	Veränderung in Prozent q/q-4 (SCA)	M			
PCH_Q4_CA	Percentage change q/q-4 (CA)	Variation en pourcentage q/q-4 (CA)	Veränderung in Prozent q/q-4 (CA)	M			
PCH_M12	Percentage change m/m-12	Variation en pourcentage m/m-12	Veränderung in Prozent m/m-12	M			
PCH_M12_NSA	Percentage change m/m-12 (NSA)	Variation en pourcentage m/m-12 (NSA)	Veränderung in Prozent m/m-12 (NSA)	M			
PCH_M12_CA	Percentage change m/m-12 (CA)	Variation en pourcentage m/m-12 (CA)	Veränderung in Prozent m/m-12 (CA)	M			
PCH_MV12	Percentage change - 12-months average	Variation en pourcentage - moyenne sur 12 mois	Veränderung in Prozent - Durchschnitt über 12 Monate	M			
PCH_M24	Percentage change m/m-24	Variation en pourcentage m/m-24	Veränderung in Prozent m/m-24	M			
PCH_1Y	Percentage change (t/t-1)	Variation en pourcentage (t/t-1)	Veränderung in Prozent (t/t-1)	M			
PCH_3Y	Percentage change (t/t-3)	Variation en pourcentage (t/t-3)	Veränderung in Prozent (t/t-3)	M			
PCH_5Y	Percentage change (t/t-5)	Variation en pourcentage (t/t-5)	Veränderung in Prozent (t/t-5)	M			
PCH_10Y	Percentage change (t/t-10)	Variation en pourcentage (t/t-10)	Veränderung in Prozent (t/t-10)	M			
PCH_WRL_1Y	Percentage of world total - 1-year change	Pourcentage du total mondial - variations sur 1 an	Prozentsatz von der Welt insgesamt - Veränderung auf 1 Jahr	M			
PCH_WRL_3Y	Percentage of world total - 3 year change	Pourcentage du total mondial - variations sur 3 ans	Prozentsatz von der Welt insgesamt - Veränderung auf 3 Jahre	M			
PCH_WRL_5Y	Percentage of world total - 5-year change	Pourcentage du total mondial - variations sur 5 ans	Prozentsatz von der Welt insgesamt - Veränderung auf 5 Jahre	M			
PCH_OECD_5Y	Percentage of OECD total - 5-year change	Pourcentage du total OCDE - variations sur 5 ans	Prozentsatz von der OECD insgesamt - Veränderung auf 5 Jahre	M			
PCH_OECD_EU_1Y	Percentage of OECD and non-OECD EU countries total - 1-year change	Pourcentage du total des pays de l’OCDE et des États membres de l'UE hors OCDE - variation sur 1 an	Prozent von OECD Ländern und von EU Mitgliedstaaten nicht in OECD insgesamt - Veränderung auf 1 Jahr	M			
PCH_OECD_EU_3Y	Percentage of OECD and non-OECD EU countries total - 3-year change	Pourcentage du total des pays de l’OCDE et des États membres de l'UE hors OCDE - variation sur 3 ans	Prozent von OECD Ländern und von EU Mitgliedstaaten nicht in OECD insgesamt - Veränderung auf 3 Jahre	M			
PCH_OECD_EU_5Y	Percentage of the total of OECD countries and EU Member States not in OECD - 5-year change	Pourcentage du total des pays de l’OCDE et des États membres de l'UE hors OCDE - variation sur 5 ans	Prozent von OECD Ländern und von EU Mitgliedstaaten nicht in OECD insgesamt - Veränderung auf 5 Jahre	M			
CP_MEUR	Current prices, million euro	Prix courants, millions d'euros	Jeweilige Preise, Millionen Euro	M			
CP_MNAC	Current prices, million units of national currency	Prix courants, millions de monnaie nationale	Jeweilige Preise, Millionen Landeswährung	M			
CP_MPPS	Current prices, million purchasing power standards	Prix courants, millions de standards de pouvoir d'achat	Jeweilige Preise, Millionen Kaufkraftstandards	M			
CP_MPPS_EU27_2020	Current prices, million purchasing power standards (PPS, EU27 from 2020)	Prix courants, millions de standards de pouvoir d'achat (SPA, UE27 à partir de 2020)	Jeweilige Preise, Millionen Kaufkraftstandards (KKS, EU27 ab 2020)	M			
CP_MUSD	Current prices, million US dollars	Prix courants, millions de dollars US	Jeweilige Preise, Millionen US Dollar	M			
CP_EUR_HAB	Current prices, euro per capita	Prix courants, euros par personne	Jeweilige Preise, Euro pro Kopf	M			
CP_NAC_HAB	Current prices, units of national currency per capita	Prix courants, monnaie nationale par personne	Jeweilige Preise, Landeswährung pro Kopf	M			
CP_PPS_HAB	Current prices, purchasing power standard per capita	Prix courants, standard de pouvoir d'achat par personne	Jeweilige Preise, Kaufkraftstandards pro Kopf	M			
CP_PPS_EU27_2020_HAB	Current prices, purchasing power standard (PPS, EU27 from 2020) per capita	Prix courants, standard de pouvoir d'achat (SPA, UE27 à partir de 2020) par personne	Jeweilige Preise, Kaufkraftstandards (KKS, EU27 ab 2020) pro Kopf	M			
CLV20_MEUR	Chain linked volumes (2020), million euro	Volumes chaînés (2020), millions d'euros	Verkettete Volumen (2020), Millionen Euro	M			
CLV15_MEUR	Chain linked volumes (2015), million euro	Volumes chaînés (2015), millions d'euros	Verkettete Volumen (2015), Millionen Euro	M			
CLV10_MEUR	Chain linked volumes (2010), million euro	Volumes chaînés (2010), millions d'euros	Verkettete Volumen (2010), Millionen Euro	M			
CLV05_MEUR	Chain linked volumes (2005), million euro	Volumes chaînés (2005), millions d'euros	Verkettete Volumen (2005), Millionen Euro	M			
CLV20_MNAC	Chain linked volumes (2020), million units of national currency	Volumes chaînés (2020), millions de monnaie nationale	Verkettete Volumen (2020), Millionen Landeswährung	M			
CLV15_MNAC	Chain linked volumes (2015), million units of national currency	Volumes chaînés (2015), millions de monnaie nationale	Verkettete Volumen (2015), Millionen Landeswährung	M			
CLV10_MNAC	Chain linked volumes (2010), million units of national currency	Volumes chaînés (2010), millions de monnaie nationale	Verkettete Volumen (2010), Millionen Landeswährung	M			
CLV05_MNAC	Chain linked volumes (2005), million units of national currency	Volumes chaînés (2005), millions de monnaie nationale	Verkettete Volumen (2005), Millionen Landeswährung	M			
CLV_I20_HAB	Chain linked volumes, Index 2020=100, per capita	Volumes chaînés, indice 2020=100, par personne	Verkettete Volumen, Index 2020=100, pro Kopf	M			
CLV_I15_HAB	Chain linked volumes, Index 2015=100, per capita	Volumes chaînés, indice 2015=100, par personne	Verkettete Volumen, Index 2015=100, pro Kopf	M			
CLV_I10_HAB	Chain linked volumes, Index 2010=100, per capita	Volumes chaînés, indice 2010=100, par personne	Verkettete Volumen, Index 2010=100, pro Kopf	M			
CLV20_EUR_HAB	Chain linked volumes (2020), euro per capita	Volumes chaînés (2020), euros par personne	Verkettete Volumen (2020), Euro pro Kopf	M			
CLV15_EUR_HAB	Chain linked volumes (2015), euro per capita	Volumes chaînés (2015), euros par personne	Verkettete Volumen (2015), Euro pro Kopf	M			
CLV10_EUR_HAB	Chain linked volumes (2010), euro per capita	Volumes chaînés (2010), euros par personne	Verkettete Volumen (2010), Euro pro Kopf	M			
CLV15_EUR_AWU	Chain linked volumes (2015), euro per annual work unit (AWU)	Volumes chaînés (2015), euro par unité de travail annuel (UTA)	Verkettete Volumen (2015), Euro pro jährliche Arbeitseinheit (JAE)	M			
CLV_PY_MEUR	Chain linked volumes, previous year, million euro	Volumes chaînés, année précédente, millions d'euros	Verkettete Volumen, Vorjahr, Millionen Euro	M			
CLV_PY_MNAC	Chain linked volumes, previous year, million units of national currency	Volumes chaînés, année précédente, millions de monnaie nationale	Verkettete Volumen, Vorjahr, Millionen Landeswährung	M			
CLV_PCH_PRE	Chain linked volumes, percentage change on previous period	Volumes chaînés, variation en pourcentage par rapport à la période précédente	Verkettete Volumen, Veränderung in Prozent gegenüber der Vorperiode	M			
CLV_PCH_SM	Chain linked volumes, percentage change compared to same period in previous year	Volumes chaînés, variation en pourcentage par rapport à la période correspondante de l'année précédente	Verkettete Volumen, Veränderung in Prozent gegenüber dem Vorjahreszeitraum	M			
